{
 "schema_version": "1.0",
 "generated_at": "2026-10-03T17:10:59+00:00",
 "tool": {
  "name": "repo-crux",
  "version": "1.0.0"
 },
 "repo": {
  "name": "node-express-realworld-example-app",
  "path": "node-express-realworld-example-app",
  "commit": "30b68e1e881462b2f4164ea09ab4c4f5699c7b0b",
  "branch": "master",
  "remote": "https://github.com/gothinkster/node-express-realworld-example-app",
  "kind": "web_backend",
  "summary": "RealWorld (Conduit) blogging API built on Express, Prisma and JWT. It handles user registration and login, articles, comments, favorites, follows and tags for Conduit frontend clients. Logged-out readers see only demo authors' content; logged-in users also see their own.",
  "languages": {
   "typescript": 1646,
   "javascript": 3
  },
  "files_analyzed": 26,
  "lines_analyzed": 1649,
  "methods_analyzed": 56
 },
 "entry_points": [
  {
   "id": "E13",
   "kind": "http",
   "trigger": "POST /api/users/login",
   "file": "src/app/routes/auth/auth.controller.ts",
   "line": 30,
   "symbol": "Sdf04w",
   "name": "router.post('/users/login')",
   "criticality": 10,
   "flows": [
    "F1"
   ],
   "description": "Login with email and password. Returns a JWT.",
   "evidence": "router.post('/users/login', async (req: Request, res: Response, next: NextFunction) => {",
   "source": "static+llm",
   "detected_by": "js-route"
  },
  {
   "id": "E12",
   "kind": "http",
   "trigger": "POST /api/users",
   "file": "src/app/routes/auth/auth.controller.ts",
   "line": 14,
   "symbol": "So7r9o",
   "name": "router.post('/users')",
   "criticality": 9,
   "flows": [
    "F2"
   ],
   "description": "Registers a user, hashes the password and returns a JWT.",
   "evidence": "router.post('/users', async (req: Request, res: Response, next: NextFunction) => {",
   "source": "static+llm",
   "detected_by": "js-route"
  },
  {
   "id": "E15",
   "kind": "http",
   "trigger": "PUT /api/user",
   "file": "src/app/routes/auth/auth.controller.ts",
   "line": 61,
   "symbol": "S9l9as",
   "name": "router.put('/user')",
   "criticality": 9,
   "flows": [
    "F3"
   ],
   "description": "Updates the authenticated user's email, username or password.",
   "evidence": "router.put('/user', auth.required, async (req: Request, res: Response, next: NextFunction) => {",
   "source": "static+llm",
   "detected_by": "js-route"
  },
  {
   "id": "E26",
   "kind": "middleware",
   "trigger": "Every route guarded by auth.required or auth.optional",
   "file": "src/app/routes/auth/auth.ts",
   "line": 4,
   "symbol": "Seetb9",
   "name": "getTokenFromHeaders",
   "criticality": 9,
   "flows": [
    "F1",
    "F3",
    "F4",
    "F5",
    "F6",
    "F7"
   ],
   "description": "express-jwt middleware that takes the token from a Token/Bearer header and sets req.auth.",
   "evidence": "const getTokenFromHeaders = (req: express.Request): string | null =>",
   "source": "llm",
   "detected_by": "llm"
  },
  {
   "id": "E3",
   "kind": "http",
   "trigger": "POST /api/articles",
   "file": "src/app/routes/article/article.controller.ts",
   "line": 71,
   "symbol": "Sr30e3",
   "name": "router.post('/articles')",
   "criticality": 8,
   "flows": [
    "F4"
   ],
   "description": "Creates an article with a slug and tags.",
   "evidence": "router.post('/articles', auth.required, async (req: Request, res: Response, next: NextFunction) => {",
   "source": "static+llm",
   "detected_by": "js-route"
  },
  {
   "id": "E5",
   "kind": "http",
   "trigger": "PUT /api/articles/:slug",
   "file": "src/app/routes/article/article.controller.ts",
   "line": 110,
   "symbol": "Smgaxl",
   "name": "router.put('/articles/:slug')",
   "criticality": 8,
   "flows": [
    "F4"
   ],
   "description": "Updates an article, gated by an ownership check. Tags are reset.",
   "evidence": "router.put(",
   "source": "static+llm",
   "detected_by": "js-route"
  },
  {
   "id": "E6",
   "kind": "http",
   "trigger": "DELETE /api/articles/:slug",
   "file": "src/app/routes/article/article.controller.ts",
   "line": 129,
   "symbol": "Stvieo",
   "name": "router.delete('/articles/:slug')",
   "criticality": 8,
   "flows": [
    "F4"
   ],
   "description": "Deletes an article, gated by an ownership check.",
   "evidence": "router.delete(",
   "source": "static+llm",
   "detected_by": "js-route"
  },
  {
   "id": "E23",
   "kind": "middleware",
   "trigger": "Express error middleware (any route error)",
   "file": "src/main.ts",
   "line": 26,
   "symbol": "Syduve",
   "name": "<callback of app.use() @L27>",
   "criticality": 8,
   "flows": [
    "F1",
    "F2",
    "F3",
    "F4",
    "F5",
    "F6",
    "F7"
   ],
   "description": "Maps JWT errors to 401, HttpException to its status code, and anything else to 500.",
   "evidence": "app.use(",
   "source": "static+llm",
   "detected_by": "express-mw"
  },
  {
   "id": "E1",
   "kind": "http",
   "trigger": "GET /api/articles",
   "file": "src/app/routes/article/article.controller.ts",
   "line": 30,
   "symbol": "S10duf",
   "name": "router.get('/articles')",
   "criticality": 7,
   "flows": [
    "F6"
   ],
   "description": "Paginated, filtered list of articles. This is the main read path.",
   "evidence": "router.get('/articles', auth.optional, async (req: Request, res: Response, next: NextFunction) => {",
   "source": "static+llm",
   "detected_by": "js-route"
  },
  {
   "id": "E9",
   "kind": "http",
   "trigger": "DELETE /api/articles/:slug/comments/:id",
   "file": "src/app/routes/article/article.controller.ts",
   "line": 190,
   "symbol": "Sip44b",
   "name": "router.delete('/articles/:slug/comments/:id')",
   "criticality": 7,
   "flows": [
    "F5"
   ],
   "description": "Deletes a comment, gated by an ownership check.",
   "evidence": "router.delete(",
   "source": "static+llm",
   "detected_by": "js-route"
  },
  {
   "id": "E14",
   "kind": "http",
   "trigger": "GET /api/user",
   "file": "src/app/routes/auth/auth.controller.ts",
   "line": 45,
   "symbol": "Sk5q2z",
   "name": "router.get('/user')",
   "criticality": 7,
   "flows": [
    "F3"
   ],
   "description": "Returns the current user and a freshly issued token.",
   "evidence": "router.get('/user', auth.required, async (req: Request, res: Response, next: NextFunction) => {",
   "source": "static+llm",
   "detected_by": "js-route"
  },
  {
   "id": "E24",
   "kind": "bootstrap",
   "trigger": "node dist/api/main.js (app.listen)",
   "file": "src/main.ts",
   "line": 55,
   "symbol": "S0mdak",
   "name": "<callback of app.listen() @L55>",
   "criticality": 7,
   "flows": [
    "F1",
    "F2",
    "F3",
    "F4",
    "F5",
    "F6",
    "F7",
    "F8"
   ],
   "description": "Starts the server on PORT.",
   "evidence": "app.listen(PORT, () => {",
   "source": "static+llm",
   "detected_by": "server-start"
  },
  {
   "id": "E2",
   "kind": "http",
   "trigger": "GET /api/articles/feed",
   "file": "src/app/routes/article/article.controller.ts",
   "line": 45,
   "symbol": "Ssx2ji",
   "name": "router.get('/articles/feed')",
   "criticality": 6,
   "flows": [
    "F6"
   ],
   "description": "Articles from followed authors. Requires auth.",
   "evidence": "router.get(",
   "source": "static+llm",
   "detected_by": "js-route"
  },
  {
   "id": "E4",
   "kind": "http",
   "trigger": "GET /api/articles/:slug",
   "file": "src/app/routes/article/article.controller.ts",
   "line": 87,
   "symbol": "Srrynd",
   "name": "router.get('/articles/:slug')",
   "criticality": 6,
   "flows": [
    "F6"
   ],
   "description": "Gets a single article by slug.",
   "evidence": "router.get(",
   "source": "static+llm",
   "detected_by": "js-route"
  },
  {
   "id": "E8",
   "kind": "http",
   "trigger": "POST /api/articles/:slug/comments",
   "file": "src/app/routes/article/article.controller.ts",
   "line": 170,
   "symbol": "Sbqv1h",
   "name": "router.post('/articles/:slug/comments')",
   "criticality": 6,
   "flows": [
    "F5"
   ],
   "description": "Adds a comment to an article.",
   "evidence": "router.post(",
   "source": "static+llm",
   "detected_by": "js-route"
  },
  {
   "id": "E7",
   "kind": "http",
   "trigger": "GET /api/articles/:slug/comments",
   "file": "src/app/routes/article/article.controller.ts",
   "line": 149,
   "symbol": "Sz5l3t",
   "name": "router.get('/articles/:slug/comments')",
   "criticality": 5,
   "flows": [
    "F5"
   ],
   "description": "Lists the comments that are visible to the caller.",
   "evidence": "router.get(",
   "source": "static+llm",
   "detected_by": "js-route"
  },
  {
   "id": "E10",
   "kind": "http",
   "trigger": "POST /api/articles/:slug/favorite",
   "file": "src/app/routes/article/article.controller.ts",
   "line": 210,
   "symbol": "S312mh",
   "name": "router.post('/articles/:slug/favorite')",
   "criticality": 5,
   "flows": [
    "F7"
   ],
   "description": "Favorites an article.",
   "evidence": "router.post(",
   "source": "static+llm",
   "detected_by": "js-route"
  },
  {
   "id": "E11",
   "kind": "http",
   "trigger": "DELETE /api/articles/:slug/favorite",
   "file": "src/app/routes/article/article.controller.ts",
   "line": 230,
   "symbol": "Sitooa",
   "name": "router.delete('/articles/:slug/favorite')",
   "criticality": 5,
   "flows": [
    "F7"
   ],
   "description": "Unfavorites an article.",
   "evidence": "router.delete(",
   "source": "static+llm",
   "detected_by": "js-route"
  },
  {
   "id": "E16",
   "kind": "http",
   "trigger": "GET /api/profiles/:username",
   "file": "src/app/routes/profile/profile.controller.ts",
   "line": 14,
   "symbol": "Snfte1",
   "name": "router.get('/profiles/:username')",
   "criticality": 5,
   "flows": [
    "F7"
   ],
   "description": "Gets a user profile and whether the caller follows it.",
   "evidence": "router.get(",
   "source": "static+llm",
   "detected_by": "js-route"
  },
  {
   "id": "E17",
   "kind": "http",
   "trigger": "POST /api/profiles/:username/follow",
   "file": "src/app/routes/profile/profile.controller.ts",